{
  "session_date": "2026-04-16",
  "run_id": "Regression 2026-04-16",
  "run_type": "regression",
  "environment": "staging",
  "score": {
    "assertions_passed": 121,
    "assertions_total": 121,
    "fixtures_passed": 62,
    "fixtures_total": 62,
    "duration_seconds": 2226
  },
  "regression_scope": {
    "categories_tested": ["Bank / Financial", "Employment", "Identity / KYC", "Utility Bills", "KYB", "Fraud", "Infrastructure"],
    "fixture_ids": [
      "BS-BDO-001", "BS-BPI-001", "BS-GOTYME-001", "BS-MAYA-001", "BS-PNB-001", "BS-UB-001",
      "BS-DEEP-BDO-001", "BS-DEEP-BPI-001", "BS-DEEP-MAYA-001", "CC-BDO-001",
      "GCASH-TXN-001", "BS-GCASH-001", "BS-MAYA-EDGE-001", "BS-METRO-001",
      "BS-TONIK-001", "BS-UBQE-001", "GCASH-90180-001", "DEDUP-GCASH-001",
      "PS-001", "PS-DEEP-001", "PS-EDGE-001", "PS-SAFC-001", "COE-001",
      "PHILID-001", "DL-001", "PASS-001", "UMID-001", "SSS-001", "PHILHEALTH-001",
      "NBI-001", "PRC-001", "ACRI-001", "HDMF-001", "POSTAL-001", "VOTERS-001",
      "DL-RAFI-001", "PASS-RAFI-001", "UMID-RAFI-001", "PRC-RAFI-001",
      "POSTAL-RAFI-001", "PHILID-RAFI-001",
      "ELEC-001", "PLDT-001", "ELEC-RAFI-001", "WATER-RAFI-001",
      "BIR-001", "DTI-001", "BIR-RAFI-001",
      "PS-FRAUD-001", "PHILID-FRAUD-TAMPERED-001", "PHILID-FRAUD-DAMAGED-001",
      "DL-FRAUD-FP-001", "PASS-FRAUD-TAMPERED-001", "PASS-FRAUD-FP-001",
      "ELEC-FRAUD-001", "BIR-FRAUD-001",
      "HEALTH-001", "SEC-001", "CACHE-001", "CROSS-001", "BLS-001", "DEDUP-001"
    ]
  },
  "clean_fixtures": [
    {"fixture_id": "BS-BDO-001", "category": "Bank / Financial", "consecutive_clean_runs": 2, "status": "New", "previously_stable": false},
    {"fixture_id": "BS-BPI-001", "category": "Bank / Financial", "consecutive_clean_runs": 2, "status": "New", "previously_stable": false},
    {"fixture_id": "BS-GOTYME-001", "category": "Bank / Financial", "consecutive_clean_runs": 2, "status": "New", "previously_stable": false},
    {"fixture_id": "BS-MAYA-001", "category": "Bank / Financial", "consecutive_clean_runs": 2, "status": "New", "previously_stable": false},
    {"fixture_id": "BS-PNB-001", "category": "Bank / Financial", "consecutive_clean_runs": 2, "status": "New", "previously_stable": false},
    {"fixture_id": "BS-UB-001", "category": "Bank / Financial", "consecutive_clean_runs": 2, "status": "New", "previously_stable": false},
    {"fixture_id": "BS-DEEP-BDO-001", "category": "Bank / Financial", "consecutive_clean_runs": 2, "status": "New", "previously_stable": false},
    {"fixture_id": "BS-DEEP-BPI-001", "category": "Bank / Financial", "consecutive_clean_runs": 2, "status": "New", "previously_stable": false},
    {"fixture_id": "BS-DEEP-MAYA-001", "category": "Bank / Financial", "consecutive_clean_runs": 2, "status": "New", "previously_stable": false},
    {"fixture_id": "CC-BDO-001", "category": "Bank / Financial", "consecutive_clean_runs": 2, "status": "New", "previously_stable": false},
    {"fixture_id": "GCASH-TXN-001", "category": "Bank / Financial", "consecutive_clean_runs": 2, "status": "New", "previously_stable": false},
    {"fixture_id": "BS-GCASH-001", "category": "Bank / Financial", "consecutive_clean_runs": 2, "status": "New", "previously_stable": false},
    {"fixture_id": "BS-MAYA-EDGE-001", "category": "Bank / Financial", "consecutive_clean_runs": 2, "status": "New", "previously_stable": false},
    {"fixture_id": "BS-METRO-001", "category": "Bank / Financial", "consecutive_clean_runs": 2, "status": "New", "previously_stable": false},
    {"fixture_id": "BS-UBQE-001", "category": "Bank / Financial", "consecutive_clean_runs": 2, "status": "New", "previously_stable": false},
    {"fixture_id": "GCASH-90180-001", "category": "Bank / Financial", "consecutive_clean_runs": 2, "status": "New", "previously_stable": false},
    {"fixture_id": "DEDUP-GCASH-001", "category": "Bank / Financial", "consecutive_clean_runs": 2, "status": "New", "previously_stable": false},
    {"fixture_id": "PS-001", "category": "Employment", "consecutive_clean_runs": 2, "status": "New", "previously_stable": false},
    {"fixture_id": "PS-DEEP-001", "category": "Employment", "consecutive_clean_runs": 2, "status": "New", "previously_stable": false},
    {"fixture_id": "PS-EDGE-001", "category": "Employment", "consecutive_clean_runs": 2, "status": "New", "previously_stable": false},
    {"fixture_id": "PS-SAFC-001", "category": "Employment", "consecutive_clean_runs": 2, "status": "New", "previously_stable": false},
    {"fixture_id": "COE-001", "category": "Employment", "consecutive_clean_runs": 2, "status": "New", "previously_stable": false},
    {"fixture_id": "PHILID-001", "category": "Identity / KYC", "consecutive_clean_runs": 2, "status": "New", "previously_stable": false},
    {"fixture_id": "DL-001", "category": "Identity / KYC", "consecutive_clean_runs": 2, "status": "New", "previously_stable": false},
    {"fixture_id": "PASS-001", "category": "Identity / KYC", "consecutive_clean_runs": 2, "status": "New", "previously_stable": false},
    {"fixture_id": "UMID-001", "category": "Identity / KYC", "consecutive_clean_runs": 2, "status": "New", "previously_stable": false},
    {"fixture_id": "SSS-001", "category": "Identity / KYC", "consecutive_clean_runs": 2, "status": "New", "previously_stable": false},
    {"fixture_id": "PHILHEALTH-001", "category": "Identity / KYC", "consecutive_clean_runs": 2, "status": "New", "previously_stable": false},
    {"fixture_id": "NBI-001", "category": "Identity / KYC", "consecutive_clean_runs": 2, "status": "New", "previously_stable": false},
    {"fixture_id": "PRC-001", "category": "Identity / KYC", "consecutive_clean_runs": 2, "status": "New", "previously_stable": false},
    {"fixture_id": "HDMF-001", "category": "Identity / KYC", "consecutive_clean_runs": 2, "status": "New", "previously_stable": false},
    {"fixture_id": "POSTAL-001", "category": "Identity / KYC", "consecutive_clean_runs": 2, "status": "New", "previously_stable": false},
    {"fixture_id": "VOTERS-001", "category": "Identity / KYC", "consecutive_clean_runs": 2, "status": "New", "previously_stable": false},
    {"fixture_id": "DL-RAFI-001", "category": "Identity / KYC", "consecutive_clean_runs": 2, "status": "New", "previously_stable": false},
    {"fixture_id": "PASS-RAFI-001", "category": "Identity / KYC", "consecutive_clean_runs": 2, "status": "New", "previously_stable": false},
    {"fixture_id": "UMID-RAFI-001", "category": "Identity / KYC", "consecutive_clean_runs": 2, "status": "New", "previously_stable": false},
    {"fixture_id": "PRC-RAFI-001", "category": "Identity / KYC", "consecutive_clean_runs": 2, "status": "New", "previously_stable": false},
    {"fixture_id": "POSTAL-RAFI-001", "category": "Identity / KYC", "consecutive_clean_runs": 2, "status": "New", "previously_stable": false},
    {"fixture_id": "PHILID-RAFI-001", "category": "Identity / KYC", "consecutive_clean_runs": 2, "status": "New", "previously_stable": false},
    {"fixture_id": "ELEC-001", "category": "Utility Bills", "consecutive_clean_runs": 2, "status": "New", "previously_stable": false},
    {"fixture_id": "PLDT-001", "category": "Utility Bills", "consecutive_clean_runs": 2, "status": "New", "previously_stable": false},
    {"fixture_id": "ELEC-RAFI-001", "category": "Utility Bills", "consecutive_clean_runs": 2, "status": "New", "previously_stable": false},
    {"fixture_id": "WATER-RAFI-001", "category": "Utility Bills", "consecutive_clean_runs": 2, "status": "New", "previously_stable": false},
    {"fixture_id": "BIR-001", "category": "KYB", "consecutive_clean_runs": 2, "status": "New", "previously_stable": false},
    {"fixture_id": "DTI-001", "category": "KYB", "consecutive_clean_runs": 2, "status": "New", "previously_stable": false},
    {"fixture_id": "BIR-RAFI-001", "category": "KYB", "consecutive_clean_runs": 2, "status": "New", "previously_stable": false},
    {"fixture_id": "PS-FRAUD-001", "category": "Fraud", "consecutive_clean_runs": 2, "status": "New", "previously_stable": false},
    {"fixture_id": "DL-FRAUD-FP-001", "category": "Fraud", "consecutive_clean_runs": 2, "status": "New", "previously_stable": false},
    {"fixture_id": "PASS-FRAUD-TAMPERED-001", "category": "Fraud", "consecutive_clean_runs": 2, "status": "New", "previously_stable": false},
    {"fixture_id": "ELEC-FRAUD-001", "category": "Fraud", "consecutive_clean_runs": 2, "status": "New", "previously_stable": false},
    {"fixture_id": "BIR-FRAUD-001", "category": "Fraud", "consecutive_clean_runs": 2, "status": "New", "previously_stable": false},
    {"fixture_id": "HEALTH-001", "category": "Infrastructure", "consecutive_clean_runs": 2, "status": "New", "previously_stable": false},
    {"fixture_id": "SEC-001", "category": "Infrastructure", "consecutive_clean_runs": 2, "status": "New", "previously_stable": false},
    {"fixture_id": "CACHE-001", "category": "Infrastructure", "consecutive_clean_runs": 2, "status": "New", "previously_stable": false},
    {"fixture_id": "CROSS-001", "category": "Infrastructure", "consecutive_clean_runs": 2, "status": "New", "previously_stable": false},
    {"fixture_id": "BLS-001", "category": "Infrastructure", "consecutive_clean_runs": 2, "status": "New", "previously_stable": false},
    {"fixture_id": "DEDUP-001", "category": "Infrastructure", "consecutive_clean_runs": 2, "status": "New", "previously_stable": false}
  ],
  "warnings": [
    {
      "fixture_id": "BS-TONIK-001",
      "category": "Bank / Financial",
      "warning_text": "transactionsOCR is empty array",
      "classification": "Needs Investigation",
      "fixture_status": "Watched",
      "kb_match": true,
      "kb_entry": "Tonik - transactionsOCR empty array",
      "action_taken": "Bug draft filed — escalated per KB recurrence rule"
    },
    {
      "fixture_id": "PHILID-FRAUD-TAMPERED-001",
      "category": "Fraud",
      "warning_text": "missing ID number/PCN (checked id_number, pcn)",
      "classification": "Monitor",